item_id,good_sentence,bad_sentence,good_human_score,bad_human_score
351,The surfer wore the swimsuit.,The surfer wore the tuxedo.,6.25,2.1
352,The surgeon examined the patient.,The surgeon examined the car.,6.05,1.2
353,The surgeon performed the surgery.,The surgeon performed the dance.,6.85,2.4
354,The surgeon used the lancet.,The surgeon used the rifle.,4.95,1.9
355,The sweeper cleaned the street.,The sweeper cleaned the window.,6.5,3.9
356,The swimmer wore the goggles.,The swimmer wore the cloak.,6.2,3.1
357,The tailor sewed the dress.,The tailor sewed the wound.,6.55,1.6
358,The teacher explained the exercise.,The teacher explained the tactic.,6.9,4.55
359,The teacher gave the homework.,The teacher gave the drug.,6.85,1.4
360,The teacher helped the child.,The teacher helped the patient.,6.1,1.95
361,The teacher lent the book.,The teacher lent the gun.,6.15,1.85
362,The teacher used the blackboard.,The teacher used the knife.,5.95,2.85
363,The teenager heard the music.,The teenager heard the lecture.,6.4,4.65
364,The terrorist released the hostage.,The terrorist released the book.,3.45,1.8
365,The thief grabbed the money.,The thief grabbed the banana.,5.0,3.7
366,The tourist read the map.,The tourist read the bible.,6.4,3.0
367,The tourist rode the camel.,The tourist rode the skates.,4.55,3.7
368,The tourist visited the museum.,The tourist visited the patient.,5.95,3.0
369,The traveller checked the bag.,The traveller checked the groceries.,6.0,4.2
370,The traveller checked the watch.,The traveller checked the team.,4.4,3.0
371,The traveller handed the bag.,The traveller handed the screwdriver.,5.8,2.1
372,The truck hit the car.,The truck hit the bag.,4.0,3.1
373,The truck plowed the snow.,The truck plowed the garden.,4.65,2.3
374,The undertaker dug the grave.,The undertaker dug the trench.,4.15,3.2
375,The usurer lent the money.,The usurer lent the toy.,5.2,1.9
376,The vandal sprayed the paint.,The vandal sprayed the perfume.,6.2,1.85
377,The veterinarian examined the dog.,The veterinarian examined the plant.,6.85,2.2
378,The violinist played the violin.,The violinist played the trumpet.,6.9,3.0
379,The violinist wore the tuxedo.,The violinist wore the helmet.,5.9,3.05
380,The volunteer brought the food.,The volunteer brought the hatchet.,6.1,1.75
381,The waiter brought the glass.,The waiter brought the guitar.,6.8,1.55
382,The waiter carried the tray.,The waiter carried the rifle.,6.35,1.55
383,The waiter cleared the bar.,The waiter cleared the road.,6.05,2.9
384,The waiter cleared the table.,The waiter cleared the tube.,6.25,2.6
385,The waiter cut the cake.,The waiter cut the hair.,4.85,1.45
386,The waiter delivered the drink.,The waiter delivered the speech.,6.35,1.6
387,The waiter fetched the water.,The waiter fetched the ball.,6.2,1.85
388,The waiter held the bottle.,The waiter held the flag.,6.15,3.5
389,The waiter mixed the drink.,The waiter mixed the cement.,5.4,1.5
390,The waiter opened the bottle.,The waiter opened the sarcophagus.,6.25,1.35
391,The waiter poured the wine.,The waiter poured the gasoline.,6.6,1.4
392,The waiter prepared the drink.,The waiter prepared the bomb.,6.4,1.1
393,The witness explained the circumstances.,The witness explained the equation.,5.6,1.8
394,The witness reported the crime.,The witness reported the birth.,6.4,2.4
395,The woman carried the bag.,The woman carried the stone.,6.25,3.1
396,The woman opened the bag.,The woman opened the manhole.,6.45,2.4
397,The woman painted the toenail.,The woman painted the sign.,6.1,3.55
